{
  "archiveIndexSha256": "374c069e3d4acbe362585319576523e5458185e2f383451c9874c1129a1375e3",
  "inventorySha256": "268a6896b333cf9f1c77d7cf4f97bc838088666385c4a6cec0d36da1129a85d5",
  "isDraft": true,
  "kind": "vhf-source-storage",
  "receipts": [
    {
      "chunk": {
        "byteSize": 201896268,
        "filename": "vhf-source-0000.zip",
        "frameCount": 64,
        "index": 0,
        "manifestSha256": "8a54e4ba73186c0acc5387ce368b42ce4b0eb47a03a202323a651ddf2ae7e17c",
        "sha256": "5ed9472ab0b619a1d6c41409f44911545dc9460af0d0e3876ac08eb467d5834c"
      },
      "inventorySha256": "268a6896b333cf9f1c77d7cf4f97bc838088666385c4a6cec0d36da1129a85d5",
      "kind": "vhf-source-release-receipt",
      "schemaVersion": "1",
      "storage": {
        "assetId": "RA_kwDOUPeMUM4hBya1",
        "method": "downloaded-from-draft-release-and-verified-every-source-sha256",
        "url": "https://github.com/dolphin23-jp/procedural-human/releases/download/untagged-ca4ffa92fcf0d7b7eda8/vhf-source-0000.zip",
        "verifiedAt": "2026-09-10T03:30:51.530769+00:00"
      }
    },
    {
      "chunk": {
        "byteSize": 199800214,
        "filename": "vhf-source-0001.zip",
        "frameCount": 64,
        "index": 1,
        "manifestSha256": "be9d71b99761a44978ac628e253dc6cd703b60bc92275858513a05c9e5044358",
        "sha256": "4ad845a28294d0a97447ae21445d8986710e77de2b1602f5cd42352047cdaf0b"
      },
      "inventorySha256": "268a6896b333cf9f1c77d7cf4f97bc838088666385c4a6cec0d36da1129a85d5",
      "kind": "vhf-source-release-receipt",
      "schemaVersion": "1",
      "storage": {
        "assetId": "RA_kwDOUPeMUM4hByiN",
        "method": "downloaded-from-draft-release-and-verified-every-source-sha256",
        "url": "https://github.com/dolphin23-jp/procedural-human/releases/download/untagged-ca4ffa92fcf0d7b7eda8/vhf-source-0001.zip",
        "verifiedAt": "2026-09-10T03:30:58.316101+00:00"
      }
    },
    {
      "chunk": {
        "byteSize": 200700462,
        "filename": "vhf-source-0002.zip",
        "frameCount": 64,
        "index": 2,
        "manifestSha256": "00f2d1ddd4915455c92cc310fb5bc6b96c50a886686175ef1017fe2ab76f47b0",
        "sha256": "909c63714b2680dd6e814a2e624bbb228b6dc78a83e3505a3435f0cd20dfe85e"
      },
      "inventorySha256": "268a6896b333cf9f1c77d7cf4f97bc838088666385c4a6cec0d36da1129a85d5",
      "kind": "vhf-source-release-receipt",
      "schemaVersion": "1",
      "storage": {
        "assetId": "RA_kwDOUPeMUM4hByt5",
        "method": "downloaded-from-draft-release-and-verified-every-source-sha256",
        "url": "https://github.com/dolphin23-jp/procedural-human/releases/download/untagged-ca4ffa92fcf0d7b7eda8/vhf-source-0002.zip",
        "verifiedAt": "2026-09-10T03:31:05.389675+00:00"
      }
    },
    {
      "chunk": {
        "byteSize": 201481268,
        "filename": "vhf-source-0003.zip",
        "frameCount": 64,
        "index": 3,
        "manifestSha256": "0cffcc772a3845eaaa1c24ff69ec9ea3e1b24ca68be1bb416b14d52f460dfcc6",
        "sha256": "5c7b183a6c399f57304c951f8ea13a67a70b7cb08d82cb9c29ab66d4757e8f17"
      },
      "inventorySha256": "268a6896b333cf9f1c77d7cf4f97bc838088666385c4a6cec0d36da1129a85d5",
      "kind": "vhf-source-release-receipt",
      "schemaVersion": "1",
      "storage": {
        "assetId": "RA_kwDOUPeMUM4hBy7A",
        "method": "downloaded-from-draft-release-and-verified-every-source-sha256",
        "url": "https://github.com/dolphin23-jp/procedural-human/releases/download/untagged-ca4ffa92fcf0d7b7eda8/vhf-source-0003.zip",
        "verifiedAt": "2026-09-10T03:31:13.149617+00:00"
      }
    },
    {
      "chunk": {
        "byteSize": 202071579,
        "filename": "vhf-source-0004.zip",
        "frameCount": 64,
        "index": 4,
        "manifestSha256": "b5521764994aa31b87d36fea6d594850fa44f1eb7093c9000dde736ee7c0c7fa",
        "sha256": "7e3e9c175b74ce871dd9d69761a14a4596e77b120718d6bf64676e47c3436e7a"
      },
      "inventorySha256": "268a6896b333cf9f1c77d7cf4f97bc838088666385c4a6cec0d36da1129a85d5",
      "kind": "vhf-source-release-receipt",
      "schemaVersion": "1",
      "storage": {
        "assetId": "RA_kwDOUPeMUM4hBzGC",
        "method": "downloaded-from-draft-release-and-verified-every-source-sha256",
        "url": "https://github.com/dolphin23-jp/procedural-human/releases/download/untagged-ca4ffa92fcf0d7b7eda8/vhf-source-0004.zip",
        "verifiedAt": "2026-09-10T03:31:21.497872+00:00"
      }
    },
    {
      "chunk": {
        "byteSize": 201918867,
        "filename": "vhf-source-0005.zip",
        "frameCount": 64,
        "index": 5,
        "manifestSha256": "2cf9f15ec3c3cc6f2cda023e12d773c304f693bfaa6a921bcd6122a124a9c298",
        "sha256": "8385613390a5f3b3123a2206bc84a48c64cd216c0cbf2364f80511814cc5c8a1"
      },
      "inventorySha256": "268a6896b333cf9f1c77d7cf4f97bc838088666385c4a6cec0d36da1129a85d5",
      "kind": "vhf-source-release-receipt",
      "schemaVersion": "1",
      "storage": {
        "assetId": "RA_kwDOUPeMUM4hBzPe",
        "method": "downloaded-from-draft-release-and-verified-every-source-sha256",
        "url": "https://github.com/dolphin23-jp/procedural-human/releases/download/untagged-ca4ffa92fcf0d7b7eda8/vhf-source-0005.zip",
        "verifiedAt": "2026-09-10T03:31:29.083631+00:00"
      }
    },
    {
      "chunk": {
        "byteSize": 203096532,
        "filename": "vhf-source-0006.zip",
        "frameCount": 64,
        "index": 6,
        "manifestSha256": "3cce2c0bab0061bbaec36a035a07950d1b67ea343963a39b8b22785a1aeea330",
        "sha256": "0dacaf32d76babc3757e27669bbd4489e895640fd2ef589b00afca53f690e80c"
      },
      "inventorySha256": "268a6896b333cf9f1c77d7cf4f97bc838088666385c4a6cec0d36da1129a85d5",
      "kind": "vhf-source-release-receipt",
      "schemaVersion": "1",
      "storage": {
        "assetId": "RA_kwDOUPeMUM4hBzZd",
        "method": "downloaded-from-draft-release-and-verified-every-source-sha256",
        "url": "https://github.com/dolphin23-jp/procedural-human/releases/download/untagged-ca4ffa92fcf0d7b7eda8/vhf-source-0006.zip",
        "verifiedAt": "2026-09-10T03:31:36.330677+00:00"
      }
    },
    {
      "chunk": {
        "byteSize": 203584081,
        "filename": "vhf-source-0007.zip",
        "frameCount": 64,
        "index": 7,
        "manifestSha256": "9e623b7d0be40a8553cd4a9907aed92bf1986e5d9878abbc409d5eb4208ae553",
        "sha256": "e53c9d0a4c555ac93d83e641299043438addf07f37d98a5313dfcd72fa1acc35"
      },
      "inventorySha256": "268a6896b333cf9f1c77d7cf4f97bc838088666385c4a6cec0d36da1129a85d5",
      "kind": "vhf-source-release-receipt",
      "schemaVersion": "1",
      "storage": {
        "assetId": "RA_kwDOUPeMUM4hBzmM",
        "method": "downloaded-from-draft-release-and-verified-every-source-sha256",
        "url": "https://github.com/dolphin23-jp/procedural-human/releases/download/untagged-ca4ffa92fcf0d7b7eda8/vhf-source-0007.zip",
        "verifiedAt": "2026-09-10T03:31:44.087082+00:00"
      }
    },
    {
      "chunk": {
        "byteSize": 202463556,
        "filename": "vhf-source-0008.zip",
        "frameCount": 64,
        "index": 8,
        "manifestSha256": "2871a15b5becae922de8cb6141aacae574369c06f72d0a74e382a19e0b6d9b03",
        "sha256": "43e7d3a87cac4dea024b6d818eded05e1b05d034b5090c0167a594640637fb69"
      },
      "inventorySha256": "268a6896b333cf9f1c77d7cf4f97bc838088666385c4a6cec0d36da1129a85d5",
      "kind": "vhf-source-release-receipt",
      "schemaVersion": "1",
      "storage": {
        "assetId": "RA_kwDOUPeMUM4hBzyQ",
        "method": "downloaded-from-draft-release-and-verified-every-source-sha256",
        "url": "https://github.com/dolphin23-jp/procedural-human/releases/download/untagged-ca4ffa92fcf0d7b7eda8/vhf-source-0008.zip",
        "verifiedAt": "2026-09-10T03:31:51.015124+00:00"
      }
    },
    {
      "chunk": {
        "byteSize": 199940911,
        "filename": "vhf-source-0009.zip",
        "frameCount": 64,
        "index": 9,
        "manifestSha256": "37d45741ac7493d7193be58fedbc99cc4ea0505b1270749a013e7d08e49b54ad",
        "sha256": "95633d622c8d0007bcd0f880fa7140795d5039cd04b53044687291be599b1437"
      },
      "inventorySha256": "268a6896b333cf9f1c77d7cf4f97bc838088666385c4a6cec0d36da1129a85d5",
      "kind": "vhf-source-release-receipt",
      "schemaVersion": "1",
      "storage": {
        "assetId": "RA_kwDOUPeMUM4hBz6w",
        "method": "downloaded-from-draft-release-and-verified-every-source-sha256",
        "url": "https://github.com/dolphin23-jp/procedural-human/releases/download/untagged-ca4ffa92fcf0d7b7eda8/vhf-source-0009.zip",
        "verifiedAt": "2026-09-10T03:31:58.140010+00:00"
      }
    },
    {
      "chunk": {
        "byteSize": 203925677,
        "filename": "vhf-source-0010.zip",
        "frameCount": 64,
        "index": 10,
        "manifestSha256": "d6cc227541c4f9fb30bbd7f7a553b7f8cc9681284fadc040babd0136a152a1d7",
        "sha256": "833bd0509bd03310085150277a1de39366af048150254e160a4c9539f640e40c"
      },
      "inventorySha256": "268a6896b333cf9f1c77d7cf4f97bc838088666385c4a6cec0d36da1129a85d5",
      "kind": "vhf-source-release-receipt",
      "schemaVersion": "1",
      "storage": {
        "assetId": "RA_kwDOUPeMUM4hByZN",
        "method": "downloaded-from-draft-release-and-verified-every-source-sha256",
        "url": "https://github.com/dolphin23-jp/procedural-human/releases/download/untagged-ca4ffa92fcf0d7b7eda8/vhf-source-0010.zip",
        "verifiedAt": "2026-09-10T03:30:46.345980+00:00"
      }
    },
    {
      "chunk": {
        "byteSize": 206936731,
        "filename": "vhf-source-0011.zip",
        "frameCount": 64,
        "index": 11,
        "manifestSha256": "e4e19b48193aefeaed4f73d3bd7abb26141e80c40ba643ad2a5b06edf140e4bd",
        "sha256": "0fd0a5469650a137ec23922a99c85488e4b4f992cbe180723b6f2da03246ad00"
      },